{
  "provenanceVersion": "1.0.0",
  "flowId": "dryrun-saas-ops-01",
  "createdAt": "2026-07-11T12:29:05.066Z",
  "git": {
    "commit": "f76c06221f33af93552ddba62e528f498238b12d"
  },
  "runtime": {
    "node": "v22.17.0",
    "npm": "10.9.2",
    "os": "Windows_NT 10.0.26200 x64"
  },
  "inputs": {
    "flowSpec": {
      "path": "flowspec-dryrun-01.json",
      "algorithm": "sha256",
      "digest": "fc246cec48ccc1d264c573557506bf9c142526fe2fe546c73afc8e5e497754ba"
    },
    "selectionSpec": {
      "path": "selectionspec-dryrun-02.json",
      "algorithm": "sha256",
      "digest": "7c0ba907fbe67b45e3630d336449bb017a016a77c3fbacd111380bedac095dc7"
    },
    "buildReport": {
      "path": "buildreport-dryrun-saas-ops-02.json",
      "algorithm": "sha256",
      "digest": "284b5f4a2915d74a5a5af0edb5f2eb0ffc8f57c6f1c5b9783de98d4d2577cb4a"
    },
    "registryInventory": {
      "path": "registry/",
      "algorithm": "sha256",
      "digest": "453313bb20ddb3c69243ab547f4690fdda147c5ad370729bfec427686b892482"
    }
  },
  "result": {
    "status": "verified",
    "durationMs": 0,
    "failure": null
  }
}
